{"id": "exp_0001", "domain": "digits-mlp", "hypothesis": {"claim": "Increasing MLP width and depth with a tuned learning rate and longer training budget yields a stronger baseline that lowers validation top-1 error below 5.0.", "source": "Standard deep MLP scaling practice; cf. modern training recipes referenced in Director guidance (capacity + regularization + LR scheduling)", "predicted_effect": "Lower val_top1_err due to greater model capacity and better convergence.", "how_to_implement": ""}, "metric_name": "val_top1_err", "parent": null, "diff": "", "config": {"lr": 0.05, "hidden": 256, "depth": 2, "weight_decay": 0.0005, "epochs": 60}, "fidelity": ["smoke"], "metric": {"name": "val_top1_err", "smoke": 7.5556, "seeds": [7.5556]}, "reasoning": {"trace": "The advisor recommends establishing a strong MLP baseline with modern training recipes before architectural changes. The current defaults (lr=0.1, hidden=64, depth=1, wd=1e-4, epochs=40) are likely underpowered: a single hidden layer of width 64 has limited capacity for digit classification. I will increase capacity (hidden=256, depth=2) and add modest regularization plus a slightly lower learning rate for stability with the deeper/wider net, and more epochs to allow convergence. This is a standard capacity+training-budget improvement that should comfortably beat the 5.0 baseline. No configs have been tried yet and nothing is ruled out, so this is a safe, high-leverage first step.", "search_space_constraints": {"ruled_out": [], "ruled_out_bounds": [], "focus": [], "priors": ["Register Attention Transformer (RATS): decompose the classification token into N learnable register tokens routing patch information through an L->N->N->L compress-communicate-broadcast attention bottleneck (2606.14701v1)"], "tried": []}, "debate": {"decision": "run", "votes": [{"role": "Innovator", "verdict": "run", "concern": "This is a sensible first baseline-establishing run, but it bundles many changes (width, depth, lr, wd, epochs) so a single result won't isolate which knob drives the gain; consider it a baseline, not a clean ablation."}, {"role": "Pragmatist", "verdict": "run", "concern": "Multiple knobs change at once (width, depth, lr, wd, epochs), so attribution will be hard if it underperforms — but as a first baseline with empty ledger, the bundled capacity+budget bump is a reasonable high-leverage starting point."}, {"role": "Contrarian", "verdict": "run", "concern": "Multiple knobs (width, depth, lr, wd, epochs) move at once, so a positive result won't attribute the gain to any single change — but as a first high-leverage baseline with an empty ledger, it's worth the run."}], "concerns": ["Innovator: This is a sensible first baseline-establishing run, but it bundles many changes (width, depth, lr, wd, epochs) so a single result won't isolate which knob drives the gain; consider it a baseline, not a clean ablation.", "Pragmatist: Multiple knobs change at once (width, depth, lr, wd, epochs), so attribution will be hard if it underperforms — but as a first baseline with empty ledger, the bundled capacity+budget bump is a reasonable high-leverage starting point.", "Contrarian: Multiple knobs (width, depth, lr, wd, epochs) move at once, so a positive result won't attribute the gain to any single change — but as a first high-leverage baseline with an empty ledger, it's worth the run."]}}, "prediction": {"predicted": -2.5, "measured": null, "calibration_error": null}, "verdict": "discarded", "registry_id": "exp_0001", "ts": 1781569466.4080791}
{"id": "exp_0002", "domain": "digits-mlp", "hypothesis": {"claim": "Reducing lr to 0.01 stabilizes training for the deeper/wider MLP, allowing the added capacity (depth=2, hidden=128) to improve generalization on digits below the 5.0 baseline.", "source": "Skill library lesson [training-stability, w=0.60]: lr=0.05 too high for scaled MLP; sweep lr 0.001-0.01 before increasing capacity", "predicted_effect": "Stable convergence and lower val_top1_err than both the diverged 7.55 run and the 5.0 baseline.", "how_to_implement": ""}, "metric_name": "val_top1_err", "parent": "exp_0001", "diff": "", "config": {"lr": 0.01, "hidden": 128, "depth": 2, "weight_decay": 0.0001, "epochs": 60}, "fidelity": ["smoke"], "metric": {"name": "val_top1_err", "smoke": 24.4444, "seeds": [24.4444]}, "reasoning": {"trace": "The advisor and skill library both indicate that lr=0.05 was too aggressive for the depth-2 net, causing divergence. Before abandoning the architecture, I should reduce lr to a more stable regime (0.001-0.01 range per the lesson) and keep moderate capacity. I'll set lr=0.01 (within the recommended stable range), use depth=2 with a slightly larger hidden=128 to give capacity while training stably, and increase epochs to 60 to allow convergence at the lower lr. Weight decay stays at default. This is a single config edit grounded in the stability lesson, not in any ruled-out or already-tried region.", "search_space_constraints": {"ruled_out": [], "ruled_out_bounds": [], "focus": [], "priors": ["Register Attention Transformer (RATS): decompose the classification token into N learnable register tokens routing patch information through an L->N->N->L compress-communicate-broadcast attention bottleneck (2606.14701v1)"], "tried": [{"lr": 0.05, "hidden": 256, "depth": 2, "weight_decay": 0.0005, "epochs": 60}]}, "debate": {"decision": "run", "votes": [{"role": "Innovator", "verdict": "run", "concern": "It's a sensible stability-grounded edit but timid; bundling lr, hidden, and epochs changes makes it hard to attribute the delta — consider isolating lr first or being bolder on capacity if this converges."}, {"role": "Pragmatist", "verdict": "run", "concern": "Multiple knobs change at once (lr, hidden, epochs) so a positive result won't cleanly attribute the gain to the lr fix versus added capacity; acceptable for a single grounded run but consider isolating lr next."}, {"role": "Contrarian", "verdict": "run", "concern": "The hypothesis bundles two changes at once — lowering lr AND raising hidden to 128 — so if it improves you won't know whether stability or capacity drove it; but as a grounded first step out of an empty ledger it's worth the run."}], "concerns": ["Innovator: It's a sensible stability-grounded edit but timid; bundling lr, hidden, and epochs changes makes it hard to attribute the delta — consider isolating lr first or being bolder on capacity if this converges.", "Pragmatist: Multiple knobs change at once (lr, hidden, epochs) so a positive result won't cleanly attribute the gain to the lr fix versus added capacity; acceptable for a single grounded run but consider isolating lr next.", "Contrarian: The hypothesis bundles two changes at once — lowering lr AND raising hidden to 128 — so if it improves you won't know whether stability or capacity drove it; but as a grounded first step out of an empty ledger it's worth the run."]}}, "prediction": {"predicted": -2.0, "measured": 16.8888, "calibration_error": 18.8888}, "verdict": "discarded", "registry_id": "exp_0002", "ts": 1781569490.527665}
{"id": "exp_0003", "domain": "digits-mlp", "hypothesis": {"claim": "A well-regularized, wider MLP (hidden=128, weight_decay=5e-4) trained at a moderate lr=0.05 with sufficient epochs (100) will converge stably and beat the 5.0 val_top1_err baseline, because prior failures stemmed from undertraining at lowered lr rather than capacity limits.", "source": "Goodfellow, Bengio & Courville, Deep Learning (2016), Ch. 7-8: regularization (weight decay) and ensuring sufficient training iterations for convergence at a given learning rate.", "predicted_effect": "val_top1_err should drop below 5.0, roughly to ~3.5-4.0, as the model trains to convergence with appropriate regularization.", "how_to_implement": ""}, "metric_name": "val_top1_err", "parent": "exp_0002", "diff": "", "config": {"lr": 0.05, "hidden": 128, "depth": 1, "weight_decay": 0.0005, "epochs": 100}, "fidelity": ["smoke"], "metric": {"name": "val_top1_err", "smoke": 4.6667, "seeds": [4.6667]}, "reasoning": {"trace": "The advisor guidance and skill library both point to a training-recipe problem, not capacity. Past runs that lowered lr (0.01, 0.05) caused undertraining or instability, partly because epochs weren't scaled up. The default lr=0.1 may be slightly high for a clean baseline on digits. The high-leverage knobs are hidden, lr, and weight_decay. I'll establish a stronger baseline: moderately increase width (hidden=128) for a bit more capacity, use a more moderate lr=0.05 BUT importantly scale epochs up to 100 to ensure convergence (directly addressing the lesson that low lr + few epochs undertrains), and slightly increase weight_decay to 0.0005 for better regularization. This stays out of the two tried configs and the ruled-out region (none). The combination of more epochs + moderate lr + regularization should let the model converge stably and beat 5.0.", "search_space_constraints": {"ruled_out": [], "ruled_out_bounds": [], "focus": ["hidden", "lr", "weight_decay"], "priors": [], "tried": [{"lr": 0.05, "hidden": 256, "depth": 2, "weight_decay": 0.0005, "epochs": 60}, {"lr": 0.01, "hidden": 128, "depth": 2, "weight_decay": 0.0001, "epochs": 60}]}, "debate": {"decision": "run", "votes": [{"role": "Innovator", "verdict": "run", "concern": "The proposal bundles three changes (width, lr, epochs, weight_decay) which confounds attribution, but it tests a coherent and literature-backed convergence hypothesis on untried territory—worth the run."}, {"role": "Pragmatist", "verdict": "run", "concern": "Multiple knobs (hidden, lr, weight_decay, epochs) change at once, so if it beats baseline attribution will be ambiguous; but it's a reasonable convergence-focused bet worth running."}, {"role": "Contrarian", "verdict": "run", "concern": "The hypothesis bundles three simultaneous changes (width, lr, weight_decay, epochs) so a win won't cleanly attribute to the claimed undertraining cause; but with no ruled-out region and these being the high-leverage knobs, it's a reasonable first stronger-baseline probe worth the run."}], "concerns": ["Innovator: The proposal bundles three changes (width, lr, epochs, weight_decay) which confounds attribution, but it tests a coherent and literature-backed convergence hypothesis on untried territory—worth the run.", "Pragmatist: Multiple knobs (hidden, lr, weight_decay, epochs) change at once, so if it beats baseline attribution will be ambiguous; but it's a reasonable convergence-focused bet worth running.", "Contrarian: The hypothesis bundles three simultaneous changes (width, lr, weight_decay, epochs) so a win won't cleanly attribute to the claimed undertraining cause; but with no ruled-out region and these being the high-leverage knobs, it's a reasonable first stronger-baseline probe worth the run."]}}, "prediction": {"predicted": -1.3, "measured": -19.7777, "calibration_error": 18.4777}, "verdict": "kept", "registry_id": "exp_0003", "ts": 1781569532.660289}
{"id": "exp_0004", "domain": "digits-mlp", "hypothesis": {"claim": "A well-regularized, wider MLP (hidden=128, weight_decay=5e-4) trained at a moderate lr=0.05 with sufficient epochs (100) will converge stably and beat the 5.0 val_top1_err baseline, because prior failures stemmed from undertraining at lowered lr rather than capacity limits.", "source": "Goodfellow, Bengio & Courville, Deep Learning (2016), Ch. 7-8: regularization (weight decay) and ensuring sufficient training iterations for convergence at a given learning rate.", "predicted_effect": "val_top1_err should drop below 5.0, roughly to ~3.5-4.0, as the model trains to convergence with appropriate regularization.", "how_to_implement": ""}, "metric_name": "val_top1_err", "parent": "exp_0003", "diff": "", "config": {"lr": 0.05, "hidden": 128, "depth": 1, "weight_decay": 0.0005, "epochs": 100}, "fidelity": ["verify"], "metric": {"name": "val_top1_err", "verify": 4.8148, "seeds": [4.6667, 4.8889, 4.8889]}, "reasoning": {"trace": "The advisor guidance and skill library both point to a training-recipe problem, not capacity. Past runs that lowered lr (0.01, 0.05) caused undertraining or instability, partly because epochs weren't scaled up. The default lr=0.1 may be slightly high for a clean baseline on digits. The high-leverage knobs are hidden, lr, and weight_decay. I'll establish a stronger baseline: moderately increase width (hidden=128) for a bit more capacity, use a more moderate lr=0.05 BUT importantly scale epochs up to 100 to ensure convergence (directly addressing the lesson that low lr + few epochs undertrains), and slightly increase weight_decay to 0.0005 for better regularization. This stays out of the two tried configs and the ruled-out region (none). The combination of more epochs + moderate lr + regularization should let the model converge stably and beat 5.0.", "search_space_constraints": {"ruled_out": [], "ruled_out_bounds": [], "focus": ["hidden", "lr", "weight_decay"], "priors": [], "tried": [{"lr": 0.05, "hidden": 256, "depth": 2, "weight_decay": 0.0005, "epochs": 60}, {"lr": 0.01, "hidden": 128, "depth": 2, "weight_decay": 0.0001, "epochs": 60}]}, "debate": {"decision": "run", "votes": [{"role": "Innovator", "verdict": "run", "concern": "The proposal bundles three changes (width, lr, epochs, weight_decay) which confounds attribution, but it tests a coherent and literature-backed convergence hypothesis on untried territory—worth the run."}, {"role": "Pragmatist", "verdict": "run", "concern": "Multiple knobs (hidden, lr, weight_decay, epochs) change at once, so if it beats baseline attribution will be ambiguous; but it's a reasonable convergence-focused bet worth running."}, {"role": "Contrarian", "verdict": "run", "concern": "The hypothesis bundles three simultaneous changes (width, lr, weight_decay, epochs) so a win won't cleanly attribute to the claimed undertraining cause; but with no ruled-out region and these being the high-leverage knobs, it's a reasonable first stronger-baseline probe worth the run."}], "concerns": ["Innovator: The proposal bundles three changes (width, lr, epochs, weight_decay) which confounds attribution, but it tests a coherent and literature-backed convergence hypothesis on untried territory—worth the run.", "Pragmatist: Multiple knobs (hidden, lr, weight_decay, epochs) change at once, so if it beats baseline attribution will be ambiguous; but it's a reasonable convergence-focused bet worth running.", "Contrarian: The hypothesis bundles three simultaneous changes (width, lr, weight_decay, epochs) so a win won't cleanly attribute to the claimed undertraining cause; but with no ruled-out region and these being the high-leverage knobs, it's a reasonable first stronger-baseline probe worth the run."]}}, "prediction": {"predicted": null, "measured": null, "calibration_error": null}, "verdict": "kept", "registry_id": "exp_0004", "ts": 1781569541.979258}
{"id": "exp_0005", "domain": "digits-mlp", "hypothesis": {"claim": "A well-regularized, wider MLP (hidden=128, weight_decay=5e-4) trained at a moderate lr=0.05 with sufficient epochs (100) will converge stably and beat the 5.0 val_top1_err baseline, because prior failures stemmed from undertraining at lowered lr rather than capacity limits.", "source": "Goodfellow, Bengio & Courville, Deep Learning (2016), Ch. 7-8: regularization (weight decay) and ensuring sufficient training iterations for convergence at a given learning rate.", "predicted_effect": "val_top1_err should drop below 5.0, roughly to ~3.5-4.0, as the model trains to convergence with appropriate regularization.", "how_to_implement": ""}, "metric_name": "val_top1_err", "parent": "exp_0004", "diff": "", "config": {"lr": 0.05, "hidden": 128, "depth": 1, "weight_decay": 0.0005, "epochs": 100}, "fidelity": ["full"], "metric": {"name": "val_top1_err", "full": 4.6667, "seeds": [4.6667]}, "reasoning": {"trace": "The advisor guidance and skill library both point to a training-recipe problem, not capacity. Past runs that lowered lr (0.01, 0.05) caused undertraining or instability, partly because epochs weren't scaled up. The default lr=0.1 may be slightly high for a clean baseline on digits. The high-leverage knobs are hidden, lr, and weight_decay. I'll establish a stronger baseline: moderately increase width (hidden=128) for a bit more capacity, use a more moderate lr=0.05 BUT importantly scale epochs up to 100 to ensure convergence (directly addressing the lesson that low lr + few epochs undertrains), and slightly increase weight_decay to 0.0005 for better regularization. This stays out of the two tried configs and the ruled-out region (none). The combination of more epochs + moderate lr + regularization should let the model converge stably and beat 5.0.", "search_space_constraints": {"ruled_out": [], "ruled_out_bounds": [], "focus": ["hidden", "lr", "weight_decay"], "priors": [], "tried": [{"lr": 0.05, "hidden": 256, "depth": 2, "weight_decay": 0.0005, "epochs": 60}, {"lr": 0.01, "hidden": 128, "depth": 2, "weight_decay": 0.0001, "epochs": 60}]}, "debate": {"decision": "run", "votes": [{"role": "Innovator", "verdict": "run", "concern": "The proposal bundles three changes (width, lr, epochs, weight_decay) which confounds attribution, but it tests a coherent and literature-backed convergence hypothesis on untried territory—worth the run."}, {"role": "Pragmatist", "verdict": "run", "concern": "Multiple knobs (hidden, lr, weight_decay, epochs) change at once, so if it beats baseline attribution will be ambiguous; but it's a reasonable convergence-focused bet worth running."}, {"role": "Contrarian", "verdict": "run", "concern": "The hypothesis bundles three simultaneous changes (width, lr, weight_decay, epochs) so a win won't cleanly attribute to the claimed undertraining cause; but with no ruled-out region and these being the high-leverage knobs, it's a reasonable first stronger-baseline probe worth the run."}], "concerns": ["Innovator: The proposal bundles three changes (width, lr, epochs, weight_decay) which confounds attribution, but it tests a coherent and literature-backed convergence hypothesis on untried territory—worth the run.", "Pragmatist: Multiple knobs (hidden, lr, weight_decay, epochs) change at once, so if it beats baseline attribution will be ambiguous; but it's a reasonable convergence-focused bet worth running.", "Contrarian: The hypothesis bundles three simultaneous changes (width, lr, weight_decay, epochs) so a win won't cleanly attribute to the claimed undertraining cause; but with no ruled-out region and these being the high-leverage knobs, it's a reasonable first stronger-baseline probe worth the run."]}}, "prediction": {"predicted": null, "measured": null, "calibration_error": null}, "verdict": "kept", "registry_id": "exp_0005", "ts": 1781569545.1456351}
